{
   "collection": "test",
   "checksum_format": "sha256",
   "version": 1,
   "checksum_encoding": "hex",
   "objects": [
      {
         "path": "subdir_b/c.txt",
         "checksum": "6f2de4a01270ba6d72d0b60d4ee5d8c67999d3dbcedeb95f9bab1826446b432f",
         "type": "dataobject"
      },
      {
         "path": "output_wrong",
         "checksum": "0d5cbdc1cd85f21602b87ad5ecff5b3aab705f67758ddcf0c47be68d11c480d1",
         "type": "dataobject"
      },
      {
         "path": "a.txt",
         "checksum": "823237c5460d242b9189d8ca7aa5d5becd3ceb5e8a8c158766275bd77f4ccc3c",
         "type": "dataobject"
      },
      {
         "path": "b.txt",
         "checksum": "a948904f2f0f479b8f8197694b30184b0d2ed1c1cd2a1ec0fb85d299a192a447",
         "type": "dataobject"
      },
      {
         "path": "output_checksum",
         "checksum": "afb09b24fd9edcd07cf37bf995cb1fb802596ec29ef101845587cfa6099c553c",
         "type": "dataobject"
      }
   ]
}
